[
  {
    "momentId": "01HQZX3F5G7K9M2N4P6R8S0T2V",
    "envelope": { "schemaVersion": "1.0.0", "createdAt": "2026-07-28T00:00:00Z", "createdBy": { "kind": "skill", "skill": "index", "skillVersion": "1.0.0" } },
    "jobId": "validate-fixture",
    "assetId": "01HQZX3F5G7K9M2N4P6R8S0T36",
    "sourceIndexId": "01HQZX3F5G7K9M2N4P6R8S0T35",
    "sourceRange": { "assetId": "01HQZX3F5G7K9M2N4P6R8S0T36", "startTicks": 0, "endTicks": 300, "timebase": { "num": 1, "den": 30 } },
    "durationSeconds": 10,
    "segmentation": { "method": "speaker_turn_x_shot_boundary", "speakerTurnIds": ["t1"], "shotIds": ["s1"], "indexerVersion": "1.0.0", "granularityBounds": { "minSeconds": 3, "maxSeconds": 30 } },
    "transcript": { "verbatimText": "we cut the price in half this month", "displayText": "We cut the price in half.", "wordCount": 8, "segmentIds": ["seg1"], "lowConfidenceWordCount": 0 },
    "visualSummary": { "value": null, "absentReason": "VLM skipped" },
    "speakers": [{ "turnId": "t1", "label": "Founder", "isCorrected": true, "lowConfidence": false }],
    "entities": [],
    "keywords": ["price"],
    "energyCues": [],
    "technicalQuality": { "flagKinds": [], "worstSeverity": "none", "usable": true },
    "rights": { "state": "cleared", "concerns": [] },
    "candidateNarrativeFunctions": [{ "function": "proof", "confidence": 0.8, "rationale": "shows the change", "source": "heuristic" }],
    "sourceDependencies": [],
    "embedding": { "model": "BAAI/bge-small-en-v1.5", "modelVersion": "1.5", "dimensions": 8, "vector": [0.9, 0.1, 0.2, 0.0, 0.1, 0.3, 0.0, 0.1] }
  },
  {
    "momentId": "01HQZX3F5G7K9M2N4P6R8S0T30",
    "envelope": { "schemaVersion": "1.0.0", "createdAt": "2026-07-28T00:00:00Z", "createdBy": { "kind": "skill", "skill": "index", "skillVersion": "1.0.0" } },
    "jobId": "validate-fixture",
    "assetId": "01HQZX3F5G7K9M2N4P6R8S0T36",
    "sourceIndexId": "01HQZX3F5G7K9M2N4P6R8S0T35",
    "sourceRange": { "assetId": "01HQZX3F5G7K9M2N4P6R8S0T36", "startTicks": 300, "endTicks": 600, "timebase": { "num": 1, "den": 30 } },
    "durationSeconds": 10,
    "segmentation": { "method": "speaker_turn_x_shot_boundary", "speakerTurnIds": ["t2"], "shotIds": ["s2"], "indexerVersion": "1.0.0", "granularityBounds": { "minSeconds": 3, "maxSeconds": 30 } },
    "transcript": { "verbatimText": "so we rebuilt the plan from scratch to make it fair", "displayText": "So we rebuilt the plan to make it fair.", "wordCount": 11, "segmentIds": ["seg2"], "lowConfidenceWordCount": 0 },
    "visualSummary": { "value": null, "absentReason": "VLM skipped" },
    "speakers": [{ "turnId": "t2", "label": "Founder", "isCorrected": true, "lowConfidence": false }],
    "entities": [],
    "keywords": ["plan"],
    "energyCues": [],
    "technicalQuality": { "flagKinds": [], "worstSeverity": "none", "usable": true },
    "rights": { "state": "cleared", "concerns": [] },
    "candidateNarrativeFunctions": [{ "function": "payoff", "confidence": 0.75, "rationale": "resolves the setup", "source": "heuristic" }],
    "sourceDependencies": [],
    "embedding": { "model": "BAAI/bge-small-en-v1.5", "modelVersion": "1.5", "dimensions": 8, "vector": [0.2, 0.1, 0.85, 0.1, 0.1, 0.0, 0.1, 0.2] }
  }
]
